id,fullName,color,cost,rarity,type,number,setName,lore,strength,willpower,inkwell,subtypes,rulesText,artist,flavorText,image,thumbnail,ownedNumber
496,Offrir un don,Amethyst,1,Common,Action,60,Les Terres d'Encres,,,,True,[],"Choisissez un personnage, déplacez 1 de ses jetons Dommage sur un personnage adverse de votre choix.",Dylan Bonner,"Par l'encre magique, j'invoque ce cadeau.%Vite mon serviteur, vole à tire-d'aile!%—Maléfique",https://api.lorcana.ravensburger.com/images/fr/expansions/3/cards/1468x2048/e6c3dd630428fd54834172b8fd2735fed9416da4.jpg?checksum=073bfde2dc814871af351d5ad39d2ddc44526a26f5873548cc10829736c618bf,https://api.lorcana.ravensburger.com/images/fr/expansions/3/cards/367x512/e6c3dd630428fd54834172b8fd2735fed9416da4.jpg?checksum=9bf0b0201c081fd0829cf77c2d495cf1e33182bd8e913dacde4931e633e2df8f,0
497,Il m'appelle,Amethyst,1,Uncommon,Action,61,Les Terres d'Encres,,,,True,['Chanson'],"(Vous pouvez un personnage coûtant 1 ou plus pour chanter cette chanson gratuitement.) Piochez une carte. Choisissez ensuite jusqu'à 3 cartes de la défausse d'un adversaire, puis remettez-les dans sa pioche et remélangez-la.",Luis Huerta,"J'ai appris, j'ai grandi",https://api.lorcana.ravensburger.com/images/fr/expansions/3/cards/1468x2048/6c1e671f9af5b46d9c1a52067bdf0e53685674f7.jpg?checksum=907ada68baee0b446084ab00d3fa68755e2506e45583ffc08a03b17c3c659ba0,https://api.lorcana.ravensburger.com/images/fr/expansions/3/cards/367x512/6c1e671f9af5b46d9c1a52067bdf0e53685674f7.jpg?checksum=8219e4a8af668288d699851a35583a6b5fced7d5f833edf34ca4a411faf1acf2,0
498,Effort désespéré,Amethyst,3,Uncommon,Action,62,Les Terres d'Encres,,,,False,[],"Choisissez un personnage adverse et épuisez-le. Choisissez ensuite l'un de vos personnages qui gagne Offensif +2 jusqu'à la fin du tour. (Lorsqu'il défie, ce personnage gagne +2.)",Ian MacDonald,J'suis là!,https://api.lorcana.ravensburger.com/images/fr/expansions/3/cards/1468x2048/511a418e72591eb7e33f703f04c3fa16df6c90bd.jpg?checksum=a35dce28392bbeea97c530df1bce07538e4aaf93a14fb2e498ea4b937bfd4c47,https://api.lorcana.ravensburger.com/images/fr/expansions/3/cards/367x512/511a418e72591eb7e33f703f04c3fa16df6c90bd.jpg?checksum=6483accc7dbc542c4a3c8bd53b67fd1531870581db9a3aa3c586ef031864d61e,0
499,Je complète ma collection,Amethyst,3,Rare,Action,63,Les Terres d'Encres,,,,True,['Chanson'],"(Vous pouvez un personnage coûtant 3 ou plus pour chanter cette chanson gratuitement.) Regardez les 5 premières cartes de votre pioche. Remettez-en autant que vous voulez sur le dessus de votre pioche et le reste en dessous, dans l'ordre de votre choix. Gagnez 1 éclat de Lore.",Koni,Décide-toi! Fais ton choix!,https://api.lorcana.ravensburger.com/images/fr/expansions/3/cards/1468x2048/a17554a0d2b15a664c0e73900184544f19e70227.jpg?checksum=fdf814b0748d956e7dfdea4fe5a86eb70b664b7882447bb4e75b29316f9bf9a6,https://api.lorcana.ravensburger.com/images/fr/expansions/3/cards/367x512/a17554a0d2b15a664c0e73900184544f19e70227.jpg?checksum=ae69e729b9a2fdfa7256b695f67a2dbb19521a303a7735ffc139c00117858810,0
500,La lampe,Amethyst,2,Rare,Item,64,Les Terres d'Encres,,,,False,[],"BIEN OU MAL Bannissez cet objet – Si vous avez un personnage Jafar en jeu, piochez 2 cartes. Si vous avez un personnage Génie en jeu, choisissez un personnage coûtant 4 ou moins et renvoyez-le dans la main de son propriétaire.",Ever Galvez,,https://api.lorcana.ravensburger.com/images/fr/expansions/3/cards/1468x2048/c66c65175fecc3103b3b587be9b5b230889c8628.jpg?checksum=194245d65e4c9d1cf868cd92d5d6cdc2671193c53ab5cc93ae133dbf3dd207d6,https://api.lorcana.ravensburger.com/images/fr/expansions/3/cards/367x512/c66c65175fecc3103b3b587be9b5b230889c8628.jpg?checksum=d42c22313b2d81d9bb617683cd78939fcac63aaeab6a4d8dbe455eb1834ef30a,0
501,Le chapeau de sorcier,Amethyst,2,Rare,Item,65,Les Terres d'Encres,,,,True,[],"INCROYABLE ÉNERGIE , 1 – Nommez une carte puis révélez la première carte de votre pioche. S'il s'agit de la carte nommée, ajoutez-la à votre main. Sinon, remettez-la sur le dessus de votre pioche.",Jiahui Eva Gao,Minnie s'en approcha prudemment. La personne qui l'avait placé ici avait sans nulle doute préparé des pièges.,https://api.lorcana.ravensburger.com/images/fr/expansions/3/cards/1468x2048/2a459380709e2fe4ac2dae5733c73225ff6cfee1.jpg?checksum=2b5432d944cf7f3d69369eac71a50fa4a1eb940d073334372d69df852b12a8e2,https://api.lorcana.ravensburger.com/images/fr/expansions/3/cards/367x512/2a459380709e2fe4ac2dae5733c73225ff6cfee1.jpg?checksum=30143142c7c7ad1fb16cbe8953fe8c3b8c4f0674fcec3973cd4cdd4df83a5026,0
502,Montagne interdite - Château de Maléfique,Amethyst,2,Common,Location,66,Les Terres d'Encres,1.0,,6.0,True,[],,Jimmy Lo,Un silence inquiétant règne autour du château... Mais méfiez-vous de ses occupants.,https://api.lorcana.ravensburger.com/images/fr/expansions/3/cards/1468x2048/59129aacfb6cebbe2c52f30ef3424209f7252e82.jpg?checksum=da0f2e12c75cd381ff3edf512a5d876b21a874785dd8584dd9880faf4647be4c,https://api.lorcana.ravensburger.com/images/fr/expansions/3/cards/367x512/59129aacfb6cebbe2c52f30ef3424209f7252e82.jpg?checksum=bd12cebae9620c4757b93bde76d7953ccdc35c12db5e4e5a181b56cb060b620e,0
503,Château de la reine - Salle du miroir,Amethyst,4,Rare,Location,67,Les Terres d'Encres,2.0,,7.0,True,[],"UTILISATION DU MIROIR Au début de votre tour, pour chacun de vos personnages sur ce lieu, vous pouvez piocher une carte.",Matthew Oates,"Ceux qui consultent le miroir peuvent choisir leur question, mais pas la réponse.",https://api.lorcana.ravensburger.com/images/fr/expansions/3/cards/1468x2048/4d89d294cd4ca9f2ca57dc24a53ffb3ef5303122.jpg?checksum=a9c7f1d0b2555596db78ef8c23c1e9f79bd3313f78d38d716973f43050d9b054,https://api.lorcana.ravensburger.com/images/fr/expansions/3/cards/367x512/4d89d294cd4ca9f2ca57dc24a53ffb3ef5303122.jpg?checksum=fc76163419ba51bb0288e82adfe5500d4ede7d041e2247a6f5d469043eb92b83,0
504,La tour du sorcier - Atelier merveilleux,Amethyst,3,Uncommon,Location,68,Les Terres d'Encres,0.0,,7.0,True,[],PLACARD À BALAIS Vous pouvez déplacer gratuitement vos personnages Balais Magiques sur ce lieu. POUVOIR MAGIQUE Les personnages sur ce lieu gagnent +1.,Wietse Treurniet,Tout ce dont vous avez besoin pour faire de la bonne magie.,https://api.lorcana.ravensburger.com/images/fr/expansions/3/cards/1468x2048/b4c96d80854dd27e76d8cc9e21960eebda52e962.jpg?checksum=3d90886b2330278fc4f04c93a271eb2578ca3643fd745e2ae1af68d31f1a94dc,https://api.lorcana.ravensburger.com/images/fr/expansions/3/cards/367x512/b4c96d80854dd27e76d8cc9e21960eebda52e962.jpg?checksum=f1edefcd57741e7581fb69353d935b919052d906afa926d6a7d43bcbc85e115f,0
505,Le frisé - Enfant perdu très costaud,Emerald,4,Common,Character,69,Les Terres d'Encres,1.0,3.0,5.0,True,"['Allié', 'Storyborn']","L'OURS Chaque fois que vous déplacez ce personnage sur un lieu, il gagne +3 pour le reste de ce tour.",Wouter Bruneel,"Tandis que Peter retenait le Capitaine Crochet, Le Frisé fit ce qu'il fait le mieux: casser des choses.   ",https://api.lorcana.ravensburger.com/images/fr/expansions/3/cards/1468x2048/a72b20062ec2c47ab2ceb97ac1bee818f8b6c6cb.jpg?checksum=00cb07cec38e7f7d12cf78ff7ac20540936124ee6793059549ba4b577fd95b9b,https://api.lorcana.ravensburger.com/images/fr/expansions/3/cards/367x512/a72b20062ec2c47ab2ceb97ac1bee818f8b6c6cb.jpg?checksum=9a0720f0e9aec880d6b1635d7df9aebd6ccff5267f58b80631bcc86812ade16a,0
506,Ondins ensorcelés - Œuvre d'Ursula,Emerald,1,Rare,Character,70,Les Terres d'Encres,2.0,0.0,1.0,False,['Storyborn'],"PAUVRES ÂMES Chaque fois que ce personnage est défié, chaque adversaire choisit une carte et la défausse.",Massimiliano Narciso,Il est tout de même arrivé que l'une ne puisse pas payer…%—Ursula,https://api.lorcana.ravensburger.com/images/fr/expansions/3/cards/1468x2048/b7103ca278a75cad8f7d065acda0c2e80da0b7dc.jpg?checksum=e631c9bb4edb048d15fa16fd90dccdaf4076dc53d9041506c1f0f197af392946,https://api.lorcana.ravensburger.com/images/fr/expansions/3/cards/367x512/b7103ca278a75cad8f7d065acda0c2e80da0b7dc.jpg?checksum=c4237bf0632c3c16e023956c77312c9d7e365569bc3f5d7163b93edd9d209aa1,0
507,Don carnage - Prince des pirates,Emerald,5,Common,Character,71,Les Terres d'Encres,2.0,4.0,4.0,True,"['Prince', 'Pirate', 'Dreamborn', 'Méchant']",Insaisissable (Seuls les personnages avec Insaisissable peuvent défier ce personnage.),Luis Huerta,"Vous ne vous attendiez pas à me retrouver ici, n'est-ce pas? Eh bien, moi non plus.",https://api.lorcana.ravensburger.com/images/fr/expansions/3/cards/1468x2048/d02560dd9d7db4467627745bd6701e809ffca6e3.jpg?checksum=18c52421da6df3f3b325f050d0c2ff0dd7672d240cdf53daaf8f9a8294be87f0,https://api.lorcana.ravensburger.com/images/fr/expansions/3/cards/367x512/d02560dd9d7db4467627745bd6701e809ffca6e3.jpg?checksum=762c736923239e78d1b00fb06c27258241e87de339d507fcce062d9aad0b842e,0
508,Flotsam - Boule puante,Emerald,3,Common,Character,72,Les Terres d'Encres,1.0,5.0,2.0,True,"['Allié', 'Dreamborn']",SINISTRE DUO Vos personnages Jetsam gagnent +3.,Brian Kesinger,Ursula a besoin d'éclats de Lore pour mener son plan à bien....,https://api.lorcana.ravensburger.com/images/fr/expansions/3/cards/1468x2048/c097638f92de80ba8d6c696b26e6e601a5f61eb7.jpg?checksum=8d7a517e12a74afda0fd60ddd003b73827880763fceb41d818b629b7825efc9b,https://api.lorcana.ravensburger.com/images/fr/expansions/3/cards/367x512/c097638f92de80ba8d6c696b26e6e601a5f61eb7.jpg?checksum=3ad77288b418c8f0e7b3add7c2a73cc702a5aa25554dfb7e3d555e2fc0d4bb03,0
509,Frère tuck - Prêtre de Nottingham,Emerald,4,Uncommon,Character,73,Les Terres d'Encres,2.0,2.0,4.0,True,"['Allié', 'Storyborn']","IMMONDE COQUIN Lorsque vous jouez ce personnage, l'adversaire ou les adversaires ayant le plus de cartes en main choisissent une carte et la défaussent.",Denny Minonne,Sortez de mon église! Ouste! Ouste! Ouste!,https://api.lorcana.ravensburger.com/images/fr/expansions/3/cards/1468x2048/35e995c107a71caeb833bb3b79f9f54781b33fa1.jpg?checksum=c30efc434fe594f880be46ba3e333eac0f488e564b415f9bee4b93137ab7d495,https://api.lorcana.ravensburger.com/images/fr/expansions/3/cards/367x512/35e995c107a71caeb833bb3b79f9f54781b33fa1.jpg?checksum=89c21c6bdc0d4ecc195481b7960d892075028b9941306741943cc8a59339720f,0
510,Helga sinclair - Femme fatale,Emerald,5,Super,Character,74,Les Terres d'Encres,2.0,4.0,4.0,False,"['Méchant', 'Floodborn']","Alter 3 (Vous pouvez payer 3 pour jouer ce personnage sur l'un de vos personnages Helga Sinclair.) ÇA CHANGE BEAUCOUP DE CHOSES Chaque fois que ce personnage est envoyé à l'aventure, vous pouvez choisir un personnage blessé et lui infliger 3 dommages.",Alice Pisoni,,https://api.lorcana.ravensburger.com/images/fr/expansions/3/cards/1468x2048/1f1362ea41d1bc65be321c0a378a20159f9a26d0.jpg?checksum=a6fdd75b61df83edc438ee2c871f34efcfa44410184be3b31212768324347438,https://api.lorcana.ravensburger.com/images/fr/expansions/3/cards/367x512/1f1362ea41d1bc65be321c0a378a20159f9a26d0.jpg?checksum=c19349824785e018f777b8130b50bb987e5d0415f20ba7c252611e966a79e99b,0
511,Helga sinclair - Partenaire vengeresse,Emerald,2,Rare,Character,75,Les Terres d'Encres,1.0,2.0,1.0,True,"['Méchant', 'Storyborn']","JE VOUS AI JAMAIS AIMÉ Lorsque ce personnage est défié et banni, bannissez le personnage qui l'a défié.",Kasia Brzezinska,On veut se débarrasser des associés?!,https://api.lorcana.ravensburger.com/images/fr/expansions/3/cards/1468x2048/450ddec8dd206c2e2ab1aeeaa90e85e51753b8b7.jpg?checksum=945e0bf3c3646535c1a05d4d5332ff54330689f1bcb8e556f246476f5e645136,https://api.lorcana.ravensburger.com/images/fr/expansions/3/cards/367x512/450ddec8dd206c2e2ab1aeeaa90e85e51753b8b7.jpg?checksum=b6340485ad54bb28ef32c8b51bc74b44badf9dbe3a736245f53d4ee0bf1d8b48,0
512,Jetsam - Boule puante,Emerald,3,Common,Character,76,Les Terres d'Encres,2.0,2.0,2.0,True,"['Allié', 'Dreamborn']","Hors d'atteinte (Les adversaires ne peuvent pas choisir ce personnage, hormis pour un défi.) SINISTRE DUO Vos personnages Flotsam gagnent Hors d'atteinte.",Brian Kesinger,"Il doit y avoir de puissants éclats de Lore ici, de très puissants.",https://api.lorcana.ravensburger.com/images/fr/expansions/3/cards/1468x2048/d54ad009d179ae346683cfc3603979bc99339ef7.jpg?checksum=ad7df75bbea0990ccb0edb58c452375a8a1736b63e368f2d7de72f8b1d9afb2a,https://api.lorcana.ravensburger.com/images/fr/expansions/3/cards/367x512/d54ad009d179ae346683cfc3603979bc99339ef7.jpg?checksum=90253f20f89e5fdbc5a29752dcb1316213b1ccdec0b0bb940872a6648322872e,0
513,Kit - Dur à cuire,Emerald,3,Uncommon,Character,77,Les Terres d'Encres,1.0,2.0,2.0,True,"['Allié', 'Storyborn']","SURFEUR DES AIRS Lorsque vous jouez ce personnage, vous pouvez choisir un personnage adverse ayant 2 ou moins et le renvoyer dans la main de son propriétaire.",Jake Parker,"On s'est bien amusé, mais excusez-moi les gars, j'dois m'en aller. Yahaa!",https://api.lorcana.ravensburger.com/images/fr/expansions/3/cards/1468x2048/d321d6f7ccf98b51540ec9d933f20898af3bd71e.jpg?checksum=d3b45c1b65b28ab651f9deb9020feb99f325fbacdde3db36b7e5b6d01b9bd9cc,https://api.lorcana.ravensburger.com/images/fr/expansions/3/cards/367x512/d321d6f7ccf98b51540ec9d933f20898af3bd71e.jpg?checksum=e4d38b70d48367ce6a4fb1e4dfec15be191cb8dd99d3aba8f3f7c59f705b6d9d,0
514,Lyle tiberius rourke - Mercenaire fourbe,Emerald,3,Super,Character,78,Les Terres d'Encres,1.0,2.0,4.0,False,"['Méchant', 'Storyborn']","VOUS VOILÀ DANS LA CONFIDENCE Lorsque vous jouez ce personnage, choisissez un personnage adverse qui gagne Combattant durant son prochain tour. (Ce personnage ne peut pas être envoyé à l'aventure et doit défier s'il le peut.) VOUS ÊTES L'HOMME QU'IL NOUS FAUT Chaque fois que l'un de vos autres personnages est banni, chaque adversaire perd 1 éclat de Lore.",Mike Parker,,https://api.lorcana.ravensburger.com/images/fr/expansions/3/cards/1468x2048/eb4ac3033e8ab3591e0fcefa8c26ce3fd36d5a0f.jpg?checksum=1feecf0b5a68ed05e93f8415df7844988c24115a946e2d6732dcc9ecbe1de53a,https://api.lorcana.ravensburger.com/images/fr/expansions/3/cards/367x512/eb4ac3033e8ab3591e0fcefa8c26ce3fd36d5a0f.jpg?checksum=3f80f36998a7a79256f9c870fe328473c8714fc936b31fd39b30fa14ae0b6641,0
515,Milo thatch - Brillant cartographe,Emerald,1,Common,Character,79,Les Terres d'Encres,1.0,2.0,2.0,True,"['Héros', 'Dreamborn']",,Giuseppe di Maio,"Croyez-moi, étudier le charabia peut vraiment vous faire voyager.",https://api.lorcana.ravensburger.com/images/fr/expansions/3/cards/1468x2048/b74f5ee9461495ba5ca4c72a7108a23904c27a05.jpg?checksum=023abc7b9b2ddbfa6e95b818f651e618a4c63a63623e6363e4a4aa220a06302e,https://api.lorcana.ravensburger.com/images/fr/expansions/3/cards/367x512/b74f5ee9461495ba5ca4c72a7108a23904c27a05.jpg?checksum=c9b48878a8444edc3a0c9aebafed0c647cadab75ba8bfad2194b0df5326fb08c,0
516,Milo thatch - Roi de l'Atlantide,Emerald,7,Legendary,Character,80,Les Terres d'Encres,3.0,4.0,4.0,False,"['Floodborn', 'Héros', 'Roi']","Alter 4 (Vous pouvez payer 4 pour jouer ce personnage sur l'un de vos personnages Milo Thatch.) ON PROFITE DE L'EFFET DE SURPRISE Lorsque ce personnage est banni, renvoyez tous les personnages adverses dans la main de leur propriétaire.",Valerio Buonfantino,Vous ne savez pas ce que vous risquez en jouant avec ce cristal.,https://api.lorcana.ravensburger.com/images/fr/expansions/3/cards/1468x2048/b888b29826bb53dc531437e723738383d8339b56.jpg?checksum=ee064f6af8c522f2b3982af033b8dc61c90413a1a38b44ee53234fdc34c21985,https://api.lorcana.ravensburger.com/images/fr/expansions/3/cards/367x512/b888b29826bb53dc531437e723738383d8339b56.jpg?checksum=135109f1ec44fafd6140c57e429962a01e231e3431427d2c9c7d9cab30e9cd2d,0
517,Morph - Gluant de l'espace,Emerald,2,Rare,Character,81,Les Terres d'Encres,1.0,2.0,1.0,True,"['Allié', 'Alien', 'Storyborn']","MIMÉTISME Vous pouvez jouer n'importe quel personnage avec Alter sur ce personnage, quel que soit son nom.",Alan Batson,"Petite crapule, frippon globuleux!%—John Silver",https://api.lorcana.ravensburger.com/images/fr/expansions/3/cards/1468x2048/1d513c0bcbe33b2e7440e5e14d0b22ef95c9d673.jpg?checksum=d058ae095410cac05e1630e37c221cc4eb535577d95fc54159db05ebd9ceb365,https://api.lorcana.ravensburger.com/images/fr/expansions/3/cards/367x512/1d513c0bcbe33b2e7440e5e14d0b22ef95c9d673.jpg?checksum=24cc2e3917a0775351d038f0582b36f423775d73bfa520288ca2d8af5dd06132,0
518,Peter pan - Chef des enfants perdus,Emerald,4,Rare,Character,82,Les Terres d'Encres,1.0,3.0,3.0,True,"['Héros', 'Dreamborn']","J'ÉTAIS VENU ÉCOUTER LES HISTOIRES Une fois par tour, lorsque ce personnage est déplacé sur un lieu, gagnez un nombre d'éclats de Lore égal à la de ce lieu.",Grace Tran,"Les Illumineurs avaient besoin de quelqu'un pour retrouver un grimoire disparu, et Peter fut le premier à se porter volontaire.",https://api.lorcana.ravensburger.com/images/fr/expansions/3/cards/1468x2048/76546f9a641ede2beab506b96df1688d889e629a.jpg?checksum=c26918607e1d58245ab95630325495c2fa373bd67bc688f5c098580789a3f8a0,https://api.lorcana.ravensburger.com/images/fr/expansions/3/cards/367x512/76546f9a641ede2beab506b96df1688d889e629a.jpg?checksum=281ebec51f42f79e6d5fa91bccbe26a5e9b425e14764389bfff20ba37a52d987,0
519,Prince jean - Roi de mauvais aloi,Emerald,5,Uncommon,Character,83,Les Terres d'Encres,2.0,2.0,4.0,False,"['Méchant', 'Storyborn', 'Prince']","COLLECTE DE TAXES Chaque fois que ce personnage est envoyé à l'aventure, chaque adversaire ayant plus d'éclats de Lore que vous en perd 2.",Koni,"Il veut qu'on l'appelle Jean le Preux, mais il ne sera que Jean l'Affreux.%—Shérif de Nottingham",https://api.lorcana.ravensburger.com/images/fr/expansions/3/cards/1468x2048/7d7116e23efef7292cad5e6f033d9a962708228c.jpg?checksum=6554d8be15fb54be9dded20db5437ccee9e924138d52e8e8db2d0f36dc009711,https://api.lorcana.ravensburger.com/images/fr/expansions/3/cards/367x512/7d7116e23efef7292cad5e6f033d9a962708228c.jpg?checksum=900c2642a7344e20e4d28456171b413826ebc7663e173ee257f5aa5597ee998a,0
520,Robin des bois - Rêveur éveillé,Emerald,6,Rare,Character,84,Les Terres d'Encres,4.0,4.0,5.0,True,"['Héros', 'Dreamborn']",,John Loren,Il est parfois agréable de laisser courir l'eau à sa place.,https://api.lorcana.ravensburger.com/images/fr/expansions/3/cards/1468x2048/be461a0cd1fda052a69c3fd94f8cf5f6f86afa34.jpg?checksum=9fb2545caae4b19d7909bf54dc3b66e565ef1cc4865415cc8fe10aae5ac2cad4,https://api.lorcana.ravensburger.com/images/fr/expansions/3/cards/367x512/be461a0cd1fda052a69c3fd94f8cf5f6f86afa34.jpg?checksum=ac3abd4fb60433513ab2f1a941402b8ba8529323a98e2aab46e8ef0e698aba3e,0
521,Shenzi - Cheffe de meute des hyènes,Emerald,4,Super,Character,85,Les Terres d'Encres,1.0,0.0,6.0,True,"['Hyène', 'Allié', 'Storyborn']","LAISSE, J'M'EN OCCUPE Tant que ce personnage se trouve sur un lieu, il gagne +3. RIEN NE PRESSE Si ce personnage se trouve sur un lieu et défie un autre personnage, vous pouvez piocher une carte.",Jochem van Gool,Nous serions ravies de vous avoir à dîner.,https://api.lorcana.ravensburger.com/images/fr/expansions/3/cards/1468x2048/1352246e33277e9d3c9090a434fa72cfa6536ae2.jpg?checksum=816499171c6d7c74627210e56d79419d8ee1e8b459e2d1c4c239e8707cf9f4cd,https://api.lorcana.ravensburger.com/images/fr/expansions/3/cards/367x512/1352246e33277e9d3c9090a434fa72cfa6536ae2.jpg?checksum=f0e553cff8d406e55d4627b887414bad06e378e7d09532f4a4720d214812ce2d,0
522,Triste sire - Aspic envenimant,Emerald,2,Common,Character,86,Les Terres d'Encres,1.0,3.0,1.0,True,"['Allié', 'Dreamborn']",Insaisissable (Seuls les personnages avec Insaisissable peuvent défier ce personnage.),Alan Batson,Le Prince Jean n'est pas le seul à collecter des taxes! ,https://api.lorcana.ravensburger.com/images/fr/expansions/3/cards/1468x2048/3c26dffc8a2e8804dfe2c8a1195cfaa5ef6d0014.jpg?checksum=51ce4eae00aa9b96e26b5d283038002a720e028a5ef7b9a58e20e21b04cc4201,https://api.lorcana.ravensburger.com/images/fr/expansions/3/cards/367x512/3c26dffc8a2e8804dfe2c8a1195cfaa5ef6d0014.jpg?checksum=4831893523223ac515dd539a4b6e897d9d673c8c3a8a972fab9a9edfebdf4973,0
523,Bobby - Lapin énergique,Emerald,2,Common,Character,87,Les Terres d'Encres,1.0,2.0,2.0,True,"['Allié', 'Storyborn']","Hors d'atteinte (Les adversaires ne peuvent pas choisir ce personnage, hormis pour un défi.)",Jeanne Plounevez,Même le plus courageux des hors-la-loi sait quand se faire oublier.,https://api.lorcana.ravensburger.com/images/fr/expansions/3/cards/1468x2048/e62d7f1eb43d87c202d2f164ba61297e71be80f4.jpg?checksum=b9dc4f1a56bf5629755f2d8e5eb8a85af4e7c7a377466af0af1e7e4e3f1906c4,https://api.lorcana.ravensburger.com/images/fr/expansions/3/cards/367x512/e62d7f1eb43d87c202d2f164ba61297e71be80f4.jpg?checksum=8ad74ace4b43d9261249fa14898c9f7cea0eda5de6eb12592c7a89cf139b0954,0
524,Monsieur starkey - Pirate sournois,Emerald,7,Uncommon,Character,88,Les Terres d'Encres,3.0,6.0,6.0,True,"['Allié', 'Pirate', 'Storyborn']",,Adam Ford,Montrez-lui la bonne direction et il se chargera du reste.,https://api.lorcana.ravensburger.com/images/fr/expansions/3/cards/1468x2048/b37f6ddcefad7e8657837d3177f9ef2462f98acf.jpg?checksum=034eaa5f6e7096820b8e533414cb9589b5e506bc6d8d6411cdd4ef541965f38e,https://api.lorcana.ravensburger.com/images/fr/expansions/3/cards/367x512/b37f6ddcefad7e8657837d3177f9ef2462f98acf.jpg?checksum=46e5362d284b7f9a913468dea69f925e9e228e2af5e4905c78a29104e3b30632,0
525,Stitch - Agent sous couverture,Emerald,5,Rare,Character,89,Les Terres d'Encres,2.0,3.0,3.0,True,"['Dreamborn', 'Alien', 'Héros']","Insaisissable (Seuls les personnages avec Insaisissable peuvent défier ce personnage.) CACHÉ Tant que ce personnage se trouve sur un lieu, il gagne Hors d'atteinte (Les adversaires ne peuvent pas choisir ce personnage, hormis pour un défi.)",Grace Tran,"Pour un look si tape à l'oeil, il est plutôt difficile à repérer!",https://api.lorcana.ravensburger.com/images/fr/expansions/3/cards/1468x2048/16b06bd9b738835e2d134fe8d596e9ab0086a985.jpg?checksum=aa05d1b043479718c7f0b1237296a094ed793f1bec92542b87d8563fccbc7a2e,https://api.lorcana.ravensburger.com/images/fr/expansions/3/cards/367x512/16b06bd9b738835e2d134fe8d596e9ab0086a985.jpg?checksum=36247e9cd6bcb9a05f4f89bbcbad34e2465863c39cc75045a30afa9a0ba94829,0
526,Ursula - Embobineuse,Emerald,2,Uncommon,Character,90,Les Terres d'Encres,1.0,1.0,3.0,True,"['Mage', 'Méchant', 'Storyborn']","UNE CHOSE DONT TU PEUX TE PASSER Lorsque vous jouez ce personnage, choisissez un adversaire qui doit révéler sa main et doit défausser une carte chanson de votre choix.",Lisanne Koeteeuw,Flotsam! Jetsam! Gardez vos yeux ouverts pour trouver des éclats de Lore. Trouvez-moi quelque chose de spécial!,https://api.lorcana.ravensburger.com/images/fr/expansions/3/cards/1468x2048/2d0c8af807ef45ac17cafb2973d866ba8f38caa9.jpg?checksum=d4b98641521a6b2abe5f20f59348b756261411fac9e706ba1112cba69b863673,https://api.lorcana.ravensburger.com/images/fr/expansions/3/cards/367x512/2d0c8af807ef45ac17cafb2973d866ba8f38caa9.jpg?checksum=dfeb621cd31688dbfe4c6bb6f3d5e5d82ee9502b3ba4e0541dbed215e9f3ddfa,0
527,Ursula - La plus perfide de toutes,Emerald,3,Legendary,Character,91,Les Terres d'Encres,1.0,2.0,3.0,True,"['Mage', 'Méchant', 'Storyborn']","QUEL CONTRAT Chaque fois que ce personnage chante une chanson, vous pouvez rejouer cette chanson gratuitement depuis votre défausse, puis la remettre sous votre pioche.",Matthew Robert Davies,Je ne veux pas grand-chose... juste les éclats les plus puissants!,https://api.lorcana.ravensburger.com/images/fr/expansions/3/cards/1468x2048/4cd66dfabbd964f8c6c4414b07cdb45dae692e19.jpg?checksum=9810e886903ec81dae389bd0be04cae185e40045a073c9a417c9616cd111ce80,https://api.lorcana.ravensburger.com/images/fr/expansions/3/cards/367x512/4cd66dfabbd964f8c6c4414b07cdb45dae692e19.jpg?checksum=c5405acb24330ab23c1c990ca157c070d4676faf96bcf6d69f6e603e51a01c96,0
528,Turbo - Mécanicien,Emerald,3,Uncommon,Character,92,Les Terres d'Encres,1.0,2.0,3.0,True,"['Allié', 'Storyborn']",Insaisissable (Seuls les personnages avec Insaisissable peuvent défier ce personnage.) DÉSASSEMBLAGE – Choisissez un objet et bannissez-le.,Valentina Graziuso,Je peux démonter n'importe quoi en moins de cinq minutes!,https://api.lorcana.ravensburger.com/images/fr/expansions/3/cards/1468x2048/8ee51caaa2c2f4ee2e5b4b7ef5a89db7df1068d7.jpg?checksum=ebe95d5595a71ca3e765fdf950fc099bd71af4ee2187c13f60f0587baaa581be,https://api.lorcana.ravensburger.com/images/fr/expansions/3/cards/367x512/8ee51caaa2c2f4ee2e5b4b7ef5a89db7df1068d7.jpg?checksum=4f4d1471001ab9ede8120bacb8c5b797b676185296f981944718619816937290,0
529,Zazu - Intendant de la Terre des Lions,Emerald,1,Common,Character,93,Les Terres d'Encres,1.0,2.0,1.0,True,"['Allié', 'Storyborn']","IL EST TEMPS DE RENTRER! Tant que ce personnage se trouve sur un lieu, il gagne +1.",Ron Baird,"Je mentirais si je disais que c'est moi qui règne ici, mais bienvenue à vous sur la Terre des Lions tout de même!",https://api.lorcana.ravensburger.com/images/fr/expansions/3/cards/1468x2048/08a35293e09f508494096c1c1b3819edb9df50db.jpg?checksum=bb41faae6d5679e6496a4013e939245348c65cd47e68e4395079f717529f2b80,https://api.lorcana.ravensburger.com/images/fr/expansions/3/cards/367x512/08a35293e09f508494096c1c1b3819edb9df50db.jpg?checksum=5f8238f16504ee67a94c6fddf024a960748d474d5fde1de3fb206d09a7be9b24,0
530,A touché mon cœuuuuur…,Emerald,2,Uncommon,Action,94,Les Terres d'Encres,,,,True,['Chanson'],(Vous pouvez un personnage coûtant 2 ou plus pour chanter cette chanson gratuitement.) Choisissez un objet et bannissez-le.,Hyuna Lee,"Ce n'est ni Don Juan, ni un génie%Mais il a touché mon cœur à vie",https://api.lorcana.ravensburger.com/images/fr/expansions/3/cards/1468x2048/215bb47da8fac3342b858ac3db09b033c6c46e0b.jpg?checksum=390dc719fa55859f041c1fb88513eb69a32f053f1d40c3e584b7e8c5d30870e0,https://api.lorcana.ravensburger.com/images/fr/expansions/3/cards/367x512/215bb47da8fac3342b858ac3db09b033c6c46e0b.jpg?checksum=1d2fffddc2521e3209b46910bf681edeea2e0a78e26bb0a84c3b0f77236e14d5,0
