id,fullName,color,cost,rarity,type,number,setName,lore,strength,willpower,inkwell,subtypes,rulesText,artist,flavorText,image,thumbnail,ownedNumber
358,Big ben - Grand-père Horloge,Sapphire,5,Super,Character,142,L'Ascension des Floodborn,2.0,2.0,5.0,True,"['Allié', 'Floodborn']","Alter 3 (Vous pouvez payer 3 pour jouer ce personnage sur l'un de vos personnages Big Ben.) Hors d'atteinte (Les adversaires ne peuvent pas choisir ce personnage, hormis pour un défi.) REPOSÉ Vos autres personnages gagnent Résistance +1. (Les dommages qui leur sont infligés sont réduits de 1.)",Isaiah Mesq,,https://api.lorcana.ravensburger.com/images/fr/expansions/2/cards/1468x2048/2a2b47bf21a372f267deccbb420567f3d450b3c0.jpg?checksum=edbec54e47ff6de47dbaeb3feffdbcbd54898e527a965a104f23bbcdba69ea6b,https://api.lorcana.ravensburger.com/images/fr/expansions/2/cards/367x512/2a2b47bf21a372f267deccbb420567f3d450b3c0.jpg?checksum=dfaf5ebaaaa3f953609fc194220cfd278bd2ef7b20af1bceea23d5b3421ccf6a,0
359,Big ben - Horloge parlante,Sapphire,2,Uncommon,Character,143,L'Ascension des Floodborn,1.0,2.0,3.0,True,"['Allié', 'Storyborn']","ATTENDEZ UNE MINUTE Vos personnages avec Combattant gagnent "" – Gagnez 1 éclat de Lore.""",Leonardo Giammichele,Ça suffit. C'est moi qui suis en charge ici.,https://api.lorcana.ravensburger.com/images/fr/expansions/2/cards/1468x2048/f47aea8bdcbd1179a1f3d91e6afeeb259488f2d1.jpg?checksum=f86f30fa05a50f1c00c316613f33f61cbc488b609f2df421a9ac5dc2fe27eaa9,https://api.lorcana.ravensburger.com/images/fr/expansions/2/cards/367x512/f47aea8bdcbd1179a1f3d91e6afeeb259488f2d1.jpg?checksum=c2ac89a9866c2bdf5fe0c1814813676ddc4dd632eba67e6c483e99714170d629,0
360,Cruella d'enfer - Collection croisière,Sapphire,2,Common,Character,144,L'Ascension des Floodborn,1.0,3.0,2.0,True,"['Méchant', 'Dreamborn']","ALLEZ, EN ROUTE Durant votre tour, ce personnage gagne Insaisissable. (Il peut défier les personnages avec Insaisissable.)",Aisha Durmagambetova,"N'est-ce pas magnifique, ma chérie? Et tout aussi élégant que moi.",https://api.lorcana.ravensburger.com/images/fr/expansions/2/cards/1468x2048/7320828c9153b2a9848d6bc45d3544236b22fc48.jpg?checksum=15ae2231d031c364feeb9ec1b9bf5e83cd9094dd20aa3cab7e2af1fa2541da6d,https://api.lorcana.ravensburger.com/images/fr/expansions/2/cards/367x512/7320828c9153b2a9848d6bc45d3544236b22fc48.jpg?checksum=9dd27a246f7c445bff0e647acb6c44c9e9462c6372be5f3729d8532180aec044,0
361,Cruella d'enfer - Cruellement infecte,Sapphire,5,Uncommon,Character,145,L'Ascension des Floodborn,2.0,4.0,3.0,True,"['Méchant', 'Floodborn']","Alter 3 (Vous pouvez payer 3 pour jouer ce personnage sur l'un de vos personnages Cruella d'Enfer.) OH NON, PAS QUESTION! Lorsque ce personnage est envoyé à l'aventure, choisissez un personnage adverse, il subit -2 pour le reste de ce tour.",GusGadget / Leonardo Giammichele,"C'est de la couture d'encre, chérie. Je ne porte que le meilleur!",https://api.lorcana.ravensburger.com/images/fr/expansions/2/cards/1468x2048/50336bc687eb161ee9fb0ddb8cf2b7e65bad865f.jpg?checksum=4713a3656612baab15fa67960c1c8f4cadbab0f0f5ac5cce9e387bb3df1f6e06,https://api.lorcana.ravensburger.com/images/fr/expansions/2/cards/367x512/50336bc687eb161ee9fb0ddb8cf2b7e65bad865f.jpg?checksum=3dea24459db399dac7d11947b3dd7161a9db01b7aabd6ac4ace05f6ce8d3dc2a,0
362,Duke weaselton - Escroc à la petite semaine,Sapphire,2,Common,Character,146,L'Ascension des Floodborn,2.0,1.0,2.0,True,['Storyborn'],"Hors d'atteinte (Les adversaires ne peuvent pas choisir ce personnage, hormis pour un défi.)",Rosa la Barbera / Leonardo Giammichele,C'est Wea-sel-ton.,https://api.lorcana.ravensburger.com/images/fr/expansions/2/cards/1468x2048/3fcfb99ec010d4a8ba364f43169465d91ca39ada.jpg?checksum=c4e6905ec58071336ffb8e03cc4741097085834ef3b721c6876108d54b8358e1,https://api.lorcana.ravensburger.com/images/fr/expansions/2/cards/367x512/3fcfb99ec010d4a8ba364f43169465d91ca39ada.jpg?checksum=aee1d2951b6539a5d3b06bbb27ff7375c3823b1c942210882be22754ed3da052,0
363,Gaston - Fort du cerveau,Sapphire,6,Rare,Character,147,L'Ascension des Floodborn,3.0,4.0,4.0,False,"['Méchant', 'Floodborn']","Alter 4 (Vous pouvez payer 4 pour jouer ce personnage sur l'un de vos personnages Gaston.) ESPRIT DÉVELOPPÉ Lorsque vous jouez ce personnage, regardez les 3 premières cartes de votre pioche, vous pouvez ajouter l'une d'elles à votre main. Remettez le reste sous votre pioche, dans l'ordre de votre choix.",Matthew Robert Davies,,https://api.lorcana.ravensburger.com/images/fr/expansions/2/cards/1468x2048/b3c0730cf3f50613e40561e67c871fdb92820cf9.jpg?checksum=b744f9371b8ab6b917a80ac337961bc1e89947309b05398068f5140590383bc0,https://api.lorcana.ravensburger.com/images/fr/expansions/2/cards/367x512/b3c0730cf3f50613e40561e67c871fdb92820cf9.jpg?checksum=0d22b77b9d53c716838a0f34064e2efc21a89e2cdbbf366719b9d717a1b91bc9,0
364,Grand pabbie - Le plus vieux et le plus sage,Sapphire,7,Super,Character,148,L'Ascension des Floodborn,3.0,3.0,6.0,False,"['Mentor', 'Storyborn']","SAVOIR ANCIEN Chaque fois que vous retirez au moins 1 jeton Dommage de l'un de vos personnages, gagnez 2 éclats de Lore.",Juan Diego Leon,Lorsqu'il parle même le ciel écoute.,https://api.lorcana.ravensburger.com/images/fr/expansions/2/cards/1468x2048/536fb6934062440c464ca2eef82b0be8e6b36cc8.jpg?checksum=de56390c01985954056c3a379e173ceb170458def2cee6c282b04fe0fcad66c5,https://api.lorcana.ravensburger.com/images/fr/expansions/2/cards/367x512/536fb6934062440c464ca2eef82b0be8e6b36cc8.jpg?checksum=dcb444a07dcf82e5921e5e6e69e8e66ff31bd6c153410d0f51c913a9f6101f6e,0
365,Flaversham - Fabricant de jouets,Sapphire,4,Rare,Character,149,L'Ascension des Floodborn,1.0,1.0,6.0,True,"['Inventeur', 'Storyborn']","MAÎTRE ARTISAN Lorsque vous jouez ce personnage ou lorsque vous l'envoyez à l'aventure, vous pouvez bannir l'un de vos objets pour piocher 2 cartes.",Leonardo Giammichele,Ses créations sont encore plus merveilleuses avec les ressources de l'Illuminarium à portée de main.,https://api.lorcana.ravensburger.com/images/fr/expansions/2/cards/1468x2048/39dfc9ffd3253c48c9af5dd55c4b3e4b4b5e6229.jpg?checksum=00fb2f800e871aa32f446e72164ba105d89588dc4f30116b01b391768864ac1b,https://api.lorcana.ravensburger.com/images/fr/expansions/2/cards/367x512/39dfc9ffd3253c48c9af5dd55c4b3e4b4b5e6229.jpg?checksum=7151b2380aa566e3e5a99a9f1701731475a5366517b37b35e81787f3f9f0f675,0
366,James - Parent modèle,Sapphire,4,Common,Character,150,L'Ascension des Floodborn,2.0,3.0,3.0,False,"['Mentor', 'Storyborn']","NE PERDS JAMAIS, JAMAIS DE VUE Lorsque ce personnage est banni, vous pouvez placer cette carte dans votre réserve d'encre, face cachée et épuisée.",Kevin Hong,,https://api.lorcana.ravensburger.com/images/fr/expansions/2/cards/1468x2048/13682ac418603aa0966369d46bbf282f562acf47.jpg?checksum=4d2f714dd7879e822fe1cf12d23d15d2fc06e39a17327248707cbe9c30496f43,https://api.lorcana.ravensburger.com/images/fr/expansions/2/cards/367x512/13682ac418603aa0966369d46bbf282f562acf47.jpg?checksum=b117060b23ba4a551c17f7b7a1896d0188dd781dfc7ae6f6157603ea627122d6,0
367,Jasmine - Héritière d'Agrabah,Sapphire,1,Common,Character,151,L'Ascension des Floodborn,1.0,1.0,2.0,True,"['Princesse', 'Héros', 'Storyborn']","J'APPRENDS VITE Lorsque vous jouez ce personnage, choisissez l'un de vos personnages et retirez-lui 1 jeton Dommage.",R. la Barbera / L. Giammichele,"Elle est peut-être jeune, mais elle a l'âme d'une véritable cheffe.",https://api.lorcana.ravensburger.com/images/fr/expansions/2/cards/1468x2048/b16a457a3302d7c1f4563df2ffc96dccf3779af7.jpg?checksum=977fe92a0f92badd52b7d7441dd112ff8b499ad1025fca77d815a2fdf8830e17,https://api.lorcana.ravensburger.com/images/fr/expansions/2/cards/367x512/b16a457a3302d7c1f4563df2ffc96dccf3779af7.jpg?checksum=65675359c55fdeecc53a9fdadf594837932e3292a0712e8524c5634500dfdfb8,0
368,Judy hopps - Policière optimiste,Sapphire,3,Uncommon,Character,152,L'Ascension des Floodborn,2.0,2.0,3.0,True,"['Héros', 'Storyborn']","ME TRAITEZ PAS DE MIGNON Lorsque vous jouez ce personnage, vous pouvez choisir un objet et le bannir. Son propriétaire pioche une carte.",Arianna Rea,Je vais faire toute la lumière sur ce qui s'est passé avec ce livre de Lore. Vous pouvez compter sur moi!,https://api.lorcana.ravensburger.com/images/fr/expansions/2/cards/1468x2048/ac2646028f5b8b9bbf7a967f4ac71b8866135211.jpg?checksum=2abdac930f7c208b9e591140167801883cba0b7275639e2a2cd00c51a699cfd8,https://api.lorcana.ravensburger.com/images/fr/expansions/2/cards/367x512/ac2646028f5b8b9bbf7a967f4ac71b8866135211.jpg?checksum=696fdfe207f8d2080e78fa5c4dd961af595b76b22b99090862dc489a12f1da5d,0
369,Madame judson - Gouvernante,Sapphire,4,Rare,Character,153,L'Ascension des Floodborn,2.0,1.0,5.0,False,"['Allié', 'Storyborn']","ORDONNÉE Chaque fois que vous jouez un personnage Floodborn, vous pouvez placer la première carte de votre pioche dans votre réserve d'encre, face cachée et épuisée.",Michaela Martin,On va arranger ça. Je vais te faire un bon thé bien chaud et tout plein de gâteaux au fromage.,https://api.lorcana.ravensburger.com/images/fr/expansions/2/cards/1468x2048/a6f16ab483da9847d431a822e6c85e144dc54f30.jpg?checksum=e8d3fda9440b5b0cae5bdd12e4111c3ea8dcccca45b090fb22645860b1419738,https://api.lorcana.ravensburger.com/images/fr/expansions/2/cards/367x512/a6f16ab483da9847d431a822e6c85e144dc54f30.jpg?checksum=d9fd39020b3e5c9b8df20fdccdb50ba9bdd5c96ca4533e9b7854a0a7b0b01af2,0
370,Nick wilde - Rusé comme un renard,Sapphire,4,Uncommon,Character,154,L'Ascension des Floodborn,2.0,2.0,4.0,True,"['Allié', 'Storyborn']","ÇA S'APPELLE UNE ARNAQUE Lorsque vous jouez ce personnage, vous pouvez reprendre en main un objet Glace à l'eau de votre défausse.",Brian Weisz,Un véritable plaisir coupable!,https://api.lorcana.ravensburger.com/images/fr/expansions/2/cards/1468x2048/06349be70bd2d5dd98d36b9b8dba0a057500fdac.jpg?checksum=e1a52b136d6d4c26d62c43f741e31035d7b160079f92e6bfe1bd0c50226f7491,https://api.lorcana.ravensburger.com/images/fr/expansions/2/cards/367x512/06349be70bd2d5dd98d36b9b8dba0a057500fdac.jpg?checksum=47c982e215c98f2573a63e1a2c74b309aaa7e7655d5cfb40e22ec5e0ad266a75,0
371,Bébé noi - Voleuse orpheline,Sapphire,2,Rare,Character,155,L'Ascension des Floodborn,2.0,1.0,2.0,True,"['Allié', 'Storyborn']","CACHE-CACHE Tant que vous avez un objet en jeu, ce personnage gagne Résistance +1 et Hors d'atteinte. (Les dommages qui lui sont infligés sont réduits de 1. Les adversaires ne peuvent pas choisir ce personnage, hormis pour un défi.)",Kristina Chouri,,https://api.lorcana.ravensburger.com/images/fr/expansions/2/cards/1468x2048/9d8974baddfc0e53300829f37e5fc88b0f5ce61b.jpg?checksum=fd43d1506db034be6535d5dcd22fd3f24bb97703988457a31b2b05699a46663d,https://api.lorcana.ravensburger.com/images/fr/expansions/2/cards/367x512/9d8974baddfc0e53300829f37e5fc88b0f5ce61b.jpg?checksum=10526d4149ba2a300bd44ccc088df1884970a35cb347c39d0e2e5e2c427a1460,0
372,Maître hibou - Conférencier à la logique implacable,Sapphire,1,Common,Character,156,L'Ascension des Floodborn,1.0,2.0,2.0,True,"['Allié', 'Storyborn']",,Agnes Christianson,"Par exemple, en se basant sur la luminosité actuelle et le subtil changement de direction du vent, je peux affirmer sans aucun doute qu'il est l'heure du thé.",https://api.lorcana.ravensburger.com/images/fr/expansions/2/cards/1468x2048/6052521b7625e31d4ee9cc706732484fcf850877.jpg?checksum=8e0b801d0596e7898e2d243ffe8ceceae284505dc618f8dae096421783be6196,https://api.lorcana.ravensburger.com/images/fr/expansions/2/cards/367x512/6052521b7625e31d4ee9cc706732484fcf850877.jpg?checksum=f19b7c9c4b3f3604f6fb4b42d34a0932ab51d9e2143192c1abb5b8f4a37e6809,0
373,Prince charmant - Héritier du trône,Sapphire,4,Rare,Character,157,L'Ascension des Floodborn,3.0,3.0,3.0,True,"['Dreamborn', 'Héros', 'Prince']",,Vicky Xie / Mariana Moreno,"Il a cherché à travers les Terres d'Encres la jeune femme qui a volé son cœur lors du bal, mais n'a fait que trouver plus de mystères.",https://api.lorcana.ravensburger.com/images/fr/expansions/2/cards/1468x2048/097ccd4f03d962011101c1221009e53461a0993f.jpg?checksum=dc1870a5ec41048b1c178b5b565ea1ca761f304a1cd40ed5e66e78650831a694,https://api.lorcana.ravensburger.com/images/fr/expansions/2/cards/367x512/097ccd4f03d962011101c1221009e53461a0993f.jpg?checksum=f702f11a29d61ff8168c7d81a3fd1314f58c42febc2fda2c1c0657ee6fce7888,0
374,Coco lapin - Hôte malgé lui,Sapphire,5,Common,Character,158,L'Ascension des Floodborn,2.0,4.0,6.0,True,"['Allié', 'Storyborn']",,Giulia Riva,"Winnie: Y'a vraiment personne? Coco Lapin: Non, personne! Winnie: Il doit y avoir quelqu'un... puisque quelqu'un vient de répondre non, personne.",https://api.lorcana.ravensburger.com/images/fr/expansions/2/cards/1468x2048/a3d12597f93e80f7f6a229cebb1c3e10d4f34ec3.jpg?checksum=afe60e038e76248e6b1a0c62861a1afbdd61ffddda4eaff893d99e5d9a829a8b,https://api.lorcana.ravensburger.com/images/fr/expansions/2/cards/367x512/a3d12597f93e80f7f6a229cebb1c3e10d4f34ec3.jpg?checksum=0de79aeaaabdfc37cbf96fda34f78235f04b1a4500612129f73c1760c1924357,0
375,Sisu - Dragon d'eau divin,Sapphire,4,Legendary,Character,159,L'Ascension des Floodborn,2.0,2.0,4.0,False,"['Héros', 'Dragon', 'Dieu', 'Storyborn']","J'AI CONFIANCE EN TOI Lorsque ce personnage est envoyé à l'aventure, regardez les 2 premières cartes de votre pioche, vous pouvez ajouter l'une d'elles à votre main. Remettez le reste sous votre pioche dans l'ordre de votre choix.",Grace Tran,"Peu importe son apparence, vous ne pouvez pas vous méprendre sur son cœur.",https://api.lorcana.ravensburger.com/images/fr/expansions/2/cards/1468x2048/6b6277afcb65d33525545904e95c2fa240632660.jpg?checksum=418c4f9ff28cedadda95f04d8aa831465253be85c57074e17b22501c6029fb45,https://api.lorcana.ravensburger.com/images/fr/expansions/2/cards/367x512/6b6277afcb65d33525545904e95c2fa240632660.jpg?checksum=de94b16c21c59a2119d32656790cfcb0be07b49aa44a66fd8d7b68e4689c582c,0
376,Nokk - Esprit de l'Eau,Sapphire,4,Common,Character,160,L'Ascension des Floodborn,1.0,4.0,3.0,True,['Storyborn'],"Hors d'atteinte (Les adversaires ne peuvent pas choisir ce personnage, hormis pour un défi.)",Hadjie Joos,"Telle l'eau, il vous glissera toujours entre les doigts.",https://api.lorcana.ravensburger.com/images/fr/expansions/2/cards/1468x2048/be057d4ca44c10a0fc1dfcffd99cce1490291dc7.jpg?checksum=46220786b698a7c63c4dd1af325551aabe5b6cab998435b7c0455118a8ac3bb8,https://api.lorcana.ravensburger.com/images/fr/expansions/2/cards/367x512/be057d4ca44c10a0fc1dfcffd99cce1490291dc7.jpg?checksum=8a44d330a3742f87974be04091937967fca2f74a252491a0e7ba3d3f77bbe3f9,0
377,Winnie l'ourson - Pense pense pense,Sapphire,3,Rare,Character,161,L'Ascension des Floodborn,2.0,2.0,3.0,True,"['Héros', 'Storyborn']","POT DE MIEL Lorsque ce personnage est envoyé à l'aventure, vous pouvez placer une carte de votre main dans votre réserve d'encre, face cachée.",Rianti Hidayat,"Aussi, quand il réfléchissait, il réfléchissait de la manière la plus réfléchie qu'il pouvait.",https://api.lorcana.ravensburger.com/images/fr/expansions/2/cards/1468x2048/0159a99ed28b0581890608d24ada9decc4874197.jpg?checksum=333c2c5f113409fb328df5241a9eb18e4e6747e1d583fbe9cbebc9b6faec42a6,https://api.lorcana.ravensburger.com/images/fr/expansions/2/cards/367x512/0159a99ed28b0581890608d24ada9decc4874197.jpg?checksum=880087a5441e9e00a7c0207dffd1a427a9eb6d2d8f24d148e94f3a1872d0c20f,0
378,Chute dans le terrier du lapin,Sapphire,4,Rare,Action,162,L'Ascension des Floodborn,,,,False,[],"Chaque joueur choisit l'un de ses personnages en jeu et le place dans sa réserve d'encre, face cachée et épuisée.",Lissette Carrera,"Tombe, tombe, tombe, flottant dans un tourbillon d'encre. Comme c'était curieux!",https://api.lorcana.ravensburger.com/images/fr/expansions/2/cards/1468x2048/ae1e7198bc3074ff1b2e9ff520c30bc1898d038e.jpg?checksum=1882584ecfa1cb2fb2774060f1eff5354935b21811c9a04ed1792251f613b225,https://api.lorcana.ravensburger.com/images/fr/expansions/2/cards/367x512/ae1e7198bc3074ff1b2e9ff520c30bc1898d038e.jpg?checksum=10b22b41a11f887e2c072b6519a793f94cd4942e0726f80122ac8757cfdc2306,0
379,Quatre douzaines d'œufs,Sapphire,4,Uncommon,Action,163,L'Ascension des Floodborn,,,,True,['Chanson'],(Vous pouvez un personnage coûtant 4 ou plus pour chanter cette chanson gratuitement.) Vos personnages gagnent Résistance +2 jusqu'au début de votre prochain tour. (Les dommages qui leur sont infligés sont réduits de 2.),Jochem van Gool,,https://api.lorcana.ravensburger.com/images/fr/expansions/2/cards/1468x2048/fd93751649ac3ea8f8772ba49c8c1fe068002835.jpg?checksum=4646d915e9dd1fc800a257fdca191d61eb624bcd6eb7a14a1f63eeebb08ac031,https://api.lorcana.ravensburger.com/images/fr/expansions/2/cards/367x512/fd93751649ac3ea8f8772ba49c8c1fe068002835.jpg?checksum=cdd0753b8e0f37f630f832312a7130e7ef2a1325cdd2fc1ec7a72a895cf54a21,0
380,Projectile de fortune,Sapphire,3,Uncommon,Action,164,L'Ascension des Floodborn,,,,False,[],Choisissez l'un de vos objets et bannissez-le pour infliger 5 dommages à un personnage au choix.,Juan Diego Leon,Armez… Visez … Noix de coco?,https://api.lorcana.ravensburger.com/images/fr/expansions/2/cards/1468x2048/a929eb33e338738d2a91e955ce7623764480253c.jpg?checksum=4b53ebd7ac72a8ef62731b5205e767d68a1aa8a1b689a4890b56e5aed10c59cc,https://api.lorcana.ravensburger.com/images/fr/expansions/2/cards/367x512/a929eb33e338738d2a91e955ce7623764480253c.jpg?checksum=bb4e554ec4a3258584f0f4af1a5199418f1abfd482ce0ae27a1cb40842944aaf,0
381,Rien à cacher,Sapphire,1,Common,Action,165,L'Ascension des Floodborn,,,,True,[],Chaque adversaire révèle sa main. Piochez une carte.,Mané Kandalyan / Jochem van Gool,Permet d'éviter les mauvaises surprises.,https://api.lorcana.ravensburger.com/images/fr/expansions/2/cards/1468x2048/74cbd2c215c2c13c4b6110ada96de8891b355dda.jpg?checksum=6552f5064ad0ab05ab3e7ed4b97d9b913cba50c71ad9b310b699ba59d0c6d11d,https://api.lorcana.ravensburger.com/images/fr/expansions/2/cards/367x512/74cbd2c215c2c13c4b6110ada96de8891b355dda.jpg?checksum=2626bb2beed2b7371b090a6330854ed1c51b255fa1c1f9b2244703f8bf7334cf,0
382,Arbalète de croc du dragon,Sapphire,3,Uncommon,Item,166,L'Ascension des Floodborn,,,,True,[],"VISÉE PRÉCISE , 2 – Choisissez un personnage, il subit -2 pour le reste de ce tour. N'APPROCHEZ PAS! , bannissez cet objet – Choisissez un personnage Dragon et bannissez-le.",Antonia Flechsig,,https://api.lorcana.ravensburger.com/images/fr/expansions/2/cards/1468x2048/69e56976fc9bee70c1d2eaa85c0c8dea9f722a2f.jpg?checksum=04ec88a6f2d0c9c17b32a47303f6277b989d87dc75f5c1dad56d7297586b1146,https://api.lorcana.ravensburger.com/images/fr/expansions/2/cards/367x512/69e56976fc9bee70c1d2eaa85c0c8dea9f722a2f.jpg?checksum=40531a9ce9edb49a4697c22b6f8e28cdb8bc40e466ca42a07d08e641c52ca510,0
383,Marmite de gumbo,Sapphire,2,Common,Item,167,L'Ascension des Floodborn,,,,True,[],Le meilleur gumbo que j'ai jamais goûté\ – Choisissez jusqu'à 2 personnages et retirez-leur 1 jeton Dommage chacun.,Tanisha Cherislin,C'est merveilleux. Il faut que tout le monde en profite.%– James,https://api.lorcana.ravensburger.com/images/fr/expansions/2/cards/1468x2048/708a77db476d737e54b8bf4663fc79b346d696d2.jpg?checksum=66e46443d8af6951e0926cce88edf55ce35c495f5deafe817c914a445560c580,https://api.lorcana.ravensburger.com/images/fr/expansions/2/cards/367x512/708a77db476d737e54b8bf4663fc79b346d696d2.jpg?checksum=38b297feb8f26d3f3e06c8ec7cf1c456c7ae502dd73f6635ded606b38872c9e6,0
384,Atelier de maurice,Sapphire,3,Rare,Item,168,L'Ascension des Floodborn,,,,False,[],"C'EST ÇA QUE TU CHERCHES? Chaque fois que vous jouez un autre objet, vous pouvez payer 1 pour piocher une carte.",Antonia Flechsig,Nous n'avons peut-être besoin que de quelques réglages pour obtenir le résultat escompté.,https://api.lorcana.ravensburger.com/images/fr/expansions/2/cards/1468x2048/f76b2ea6b45eff3bc8e4399145cc17a0601f5c8d.jpg?checksum=f7c5d4288f1276077e5328f8c9e7c6ccc78ea4343fedefca06c484807bc230dd,https://api.lorcana.ravensburger.com/images/fr/expansions/2/cards/367x512/f76b2ea6b45eff3bc8e4399145cc17a0601f5c8d.jpg?checksum=b61863c98906d35e1dc70078b6ea4e526f0d41657edb447a0fb979245ac6a83e,0
385,Glace à l'eau,Sapphire,1,Common,Item,169,L'Ascension des Floodborn,,,,True,[],"JUMBO POP Lorsque vous jouez cet objet, vous pouvez piocher une carte. C'EST DU BÂTON ROUGE Bannissez cet objet – Choisissez un personnage et retirez-lui jusqu'à 2 jetons Dommage.",Isaiah Mesq,,https://api.lorcana.ravensburger.com/images/fr/expansions/2/cards/1468x2048/2659fc519890c924f82b4475ddd71b058178d02b.jpg?checksum=e30a46b0a644723174d9abf8d4745a39f0e8c07fb077f4d6982d3227b933f885,https://api.lorcana.ravensburger.com/images/fr/expansions/2/cards/367x512/2659fc519890c924f82b4475ddd71b058178d02b.jpg?checksum=dfdc8d0a2e25d545b260de206fc9a5ab0f67d940f6328a9d971a1db003fee9f4,0
386,Boîte de sardines,Sapphire,4,Uncommon,Item,170,L'Ascension des Floodborn,,,,True,[],"CABINE DE VOL Vos personnages épuisés gagnent Hors d'atteinte. (Ils ne peuvent pas être choisis par vos adversaires, hormis pour un défi.)",Peter Brockhammer,"Vol 3759, embarquement immédiat! Allons chercher cet éclat de Lore!%- Orville",https://api.lorcana.ravensburger.com/images/fr/expansions/2/cards/1468x2048/717b2f3d8816830549097908c134e1729c516542.jpg?checksum=58bb6931f81b8d1eb4a9813e69a7ecc7f0d55da269945c1e08c782628cc72851,https://api.lorcana.ravensburger.com/images/fr/expansions/2/cards/367x512/717b2f3d8816830549097908c134e1729c516542.jpg?checksum=0aea5bdc631b9483b3e1aaddae770ce78b5e180c119402be327e62f828e41643,0
387,La bête - Reclus inhospitalier,Steel,4,Common,Character,171,L'Ascension des Floodborn,1.0,3.0,4.0,True,"['Dreamborn', 'Héros', 'Prince']","VOTRE PRÉSENCE M'EST INTOLÉRABLE Lorsque vous jouez ce personnage, vous pouvez choisir un personnage et lui infliger 1 dommage.",Alice Pisoni,Malheur à celui qui croisera son regard.,https://api.lorcana.ravensburger.com/images/fr/expansions/2/cards/1468x2048/94940e534aedd3f6d9bb77c6322f6641dbb7432a.jpg?checksum=b6873826aea79f92643c6fe2a4aa0dbb185957160f9eb4fea1c1968d6d6f415e,https://api.lorcana.ravensburger.com/images/fr/expansions/2/cards/367x512/94940e534aedd3f6d9bb77c6322f6641dbb7432a.jpg?checksum=36139f67da97e78a4413d34e6c77bcc3090aa6c6fc3df0bd0243a12abf9578dd,0
388,La bête - Prêt à se sacrifier,Steel,6,Super,Character,172,L'Ascension des Floodborn,1.0,2.0,8.0,True,"['Héros', 'Storyborn', 'Prince']","PROTÉGER LES AUTRES Si des dommages sont infligés à l'un de vos personnages, placez-les sur ce personnage à la place.",Matthew Robert Davies,Il faudra d'abord me passer sur le corps.,https://api.lorcana.ravensburger.com/images/fr/expansions/2/cards/1468x2048/c1aa04bf421e5b38c3d18933e9994d3f289def65.jpg?checksum=0164b8f9813ca252a552309c3fb09263214afcb613a0d25e2dcfcbfa86158bf6,https://api.lorcana.ravensburger.com/images/fr/expansions/2/cards/367x512/c1aa04bf421e5b38c3d18933e9994d3f289def65.jpg?checksum=e4a54e650edf660301c3849275859ed691716990869205acca6c290f5950359a,0
389,La bête - Héros tragique,Steel,5,Legendary,Character,173,L'Ascension des Floodborn,2.0,3.0,5.0,True,"['Floodborn', 'Héros', 'Prince']","Alter 3 (Vous pouvez payer 3 pour jouer ce personnage sur l'un de vos personnages La Bête.) C'EST PEUT-ÊTRE MIEUX COMME ÇA Si ce personnage n'a aucun jeton dommage sur lui au début de votre tour, piochez une carte. Sinon, il gagne +4 pour le reste de ce tour.",Evana Kisa,"Rester une Bête à tout jamais, tel est mon destin.",https://api.lorcana.ravensburger.com/images/fr/expansions/2/cards/1468x2048/572e20738130fddc7c389f2ab14f4e4b22a97c39.jpg?checksum=7696935c97fa37d56673c02bd011c1fa2b76488b748d79eaacd27936ae934e4b,https://api.lorcana.ravensburger.com/images/fr/expansions/2/cards/367x512/572e20738130fddc7c389f2ab14f4e4b22a97c39.jpg?checksum=e712ac97d51e2ed5ffd943c70128fb0ac5c8f5814a372ee96307f9b15c3e912e,0
390,Benja - Gardien de la Pierre de Dragon,Steel,3,Common,Character,174,L'Ascension des Floodborn,2.0,2.0,3.0,True,"['Mentor', 'Storyborn', 'Roi']","NOUS DEVONS CHOISIR Lorsque vous jouez ce personnage, vous pouvez choisir un objet et le bannir.",Grace Tran,Ne confondez pas courage et compétence.,https://api.lorcana.ravensburger.com/images/fr/expansions/2/cards/1468x2048/d094700e379f0fb3b543e25c77f8e4b3e068f057.jpg?checksum=5e28e4ee749d5d65d3ac7d3d4a7fa5ee1f94e10d8d7f5c52cf2b71344970fa99,https://api.lorcana.ravensburger.com/images/fr/expansions/2/cards/367x512/d094700e379f0fb3b543e25c77f8e4b3e068f057.jpg?checksum=81419679a33692e519516fb8c3fbecfef313904d72eb4765fccd3b7b3cf41627,0
391,Chef bogo - Officier respecté,Steel,4,Rare,Character,175,L'Ascension des Floodborn,2.0,2.0,4.0,False,['Dreamborn'],"INSUBORDINATION! Chaque fois que vous jouez un personnage Floodborn, infligez 1 dommage à chaque personnage adverse.",Adam Bunch,"Nous pouvons confirmer que l'inondation d'encre a été causée par une explosion. Nous avons la situation en main, maintenant évacuez la zone.",https://api.lorcana.ravensburger.com/images/fr/expansions/2/cards/1468x2048/04f1241ed2b1b531c2c853ce1eeff952cd0f40f3.jpg?checksum=002eef479079f52735f3d1ebf1a0cb211d2fa7405e1e27d139c1eda6732398c2,https://api.lorcana.ravensburger.com/images/fr/expansions/2/cards/367x512/04f1241ed2b1b531c2c853ce1eeff952cd0f40f3.jpg?checksum=fc2a8aabe59376d389fa5fecb1c8049274164327903a35491bfaefad868c95bb,0
